{
  "schema_version": 1,
  "id": "demo-organizer",
  "destination": "Specify a local document organizer without inventing a hosted SaaS.",
  "scope": "Resolve privacy and parser choices for a synthetic CLI example only.",
  "constraints": [
    "No production actions and no document upload to external services."
  ],
  "exclusions": [
    "Marketing, sales, billing and a website are not requested."
  ],
  "fog": [
    {
      "id": "grouping",
      "description": "The rules for grouping and naming local documents still need a precise user example."
    }
  ],
  "max_parallel_claims": 1
}
